{
  "$schema": "https://agent-studio.io/schema/v2",
  "metadata": {
    "version": "2.0",
    "name": "ladle_dispatcher",
    "title": "钢包调度员智能体",
    "group": "scheduling",
    "description": "用于转炉配包的调度型智能体。"
  },
  "attributes": {
    "maxDispatchWindowSec": {
      "type": "number",
      "default": 90
    },
    "temperatureSafetyMargin": {
      "type": "number",
      "default": 20
    },
    "dispatchTimeoutSec": {
      "type": "number",
      "default": 240
    },
    "maxReplanTimes": {
      "type": "number",
      "default": 3
    }
  },
  "variables": {
    "dispatchMode": {
      "type": "string",
      "default": "normal",
      "x-category": "state",
      "x-audit": true
    },
    "processStatus": {
      "type": "string",
      "x-category": "state",
      "default": "idle",
      "x-audit": true
    },
    "pendingRequests": {
      "type": "array",
      "default": [],
      "x-audit": true
    },
    "candidateRanking": {
      "type": "array",
      "default": [],
      "x-audit": true
    },
    "activeAssignments": {
      "type": "object",
      "default": {},
      "x-audit": true
    },
    "resourceLocks": {
      "type": "object",
      "default": {},
      "x-audit": true
    },
    "replanCounter": {
      "type": "number",
      "default": 0,
      "x-category": "metric",
      "x-audit": true
    },
    "lastError": {
      "type": "string",
      "default": "",
      "x-audit": true
    }
  },
  "derivedProperties": {},
  "rules": {
    "requestPayloadValid": {
      "condition": "args.requestId != null && args.converterId != null && args.requiredByTime != null && args.steelGrade != null",
      "onViolation": {
        "action": "reject",
        "error": {
          "code": "INVALID_REQUEST_PAYLOAD"
        }
      }
    },
    "ladleNotLocked": {
      "condition": "args.isLocked != true",
      "onViolation": {
        "action": "reject",
        "error": {
          "code": "LADLE_ALREADY_LOCKED"
        }
      }
    },
    "gradeCompatible": {
      "condition": "args.gradeCompatible == true",
      "onViolation": {
        "action": "reject",
        "error": {
          "code": "GRADE_NOT_COMPATIBLE"
        }
      }
    },
    "temperatureSufficient": {
      "condition": "args.estimatedArrivalTemp == null || args.minRequiredTemp == null || args.estimatedArrivalTemp >= args.minRequiredTemp + this.attributes.temperatureSafetyMargin",
      "onViolation": {
        "action": "reject",
        "error": {
          "code": "ARRIVAL_TEMPERATURE_LOW"
        }
      }
    },
    "replanWithinLimit": {
      "condition": "this.variables.replanCounter < this.attributes.maxReplanTimes",
      "onViolation": {
        "action": "warn",
        "warning": {
          "code": "REPLAN_LIMIT_REACHED"
        }
      }
    }
  },
  "functions": {
    "estimateArrivalTime": {
      "type": "script",
      "scriptEngine": "python",
      "script": "eta_sec = max(0, args.get('baseTravelSec', 0) + args.get('queueDelaySec', 0))\nreturn {'etaSec': eta_sec}",
      "parameters": {
        "baseTravelSec": {
          "type": "number"
        },
        "queueDelaySec": {
          "type": "number"
        }
      },
      "returns": {
        "etaSec": {
          "type": "number"
        }
      }
    },
    "scoreCandidate": {
      "type": "script",
      "scriptEngine": "python",
      "script": "eta = args.get('etaScore', 0)\ntemp = args.get('tempScore', 0)\ngrade = args.get('gradeScore', 0)\nconflict = args.get('conflictPenalty', 0)\ntotal = 0.4 * eta + 0.3 * temp + 0.2 * grade - 0.1 * conflict\nreturn {'totalScore': total}",
      "parameters": {
        "etaScore": {
          "type": "number"
        },
        "tempScore": {
          "type": "number"
        },
        "gradeScore": {
          "type": "number"
        },
        "conflictPenalty": {
          "type": "number"
        }
      },
      "returns": {
        "totalScore": {
          "type": "number"
        }
      }
    },
    "getCandidateLadles": {
      "type": "script",
      "scriptEngine": "python",
      "scriptPath": "scripts/ladle_dispatcher/getCandidateLadles.py",
      "entrypoint": "getCandidateLadles",
      "description": "查询并筛选可用钢包候选集，实现位于外部 Python 文件。",
      "parameters": {
        "requestId": {
          "type": "string"
        },
        "converterId": {
          "type": "string"
        },
        "steelGrade": {
          "type": "string"
        },
        "requiredByTime": {
          "type": "string"
        },
        "priority": {
          "type": "number"
        },
        "minRequiredTemp": {
          "type": "number"
        },
        "requiredWeight": {
          "type": "number"
        },
        "availableLadles": {
          "type": "array",
          "description": "可选，用于测试或外部注入钢包列表"
        }
      },
      "returns": {
        "candidates": {
          "type": "array",
          "description": "候选钢包列表，含预计算得分"
        },
        "candidateCount": {
          "type": "number"
        }
      }
    }
  },
  "services": {
    "createDispatchTask": {
      "type": "script",
      "scriptEngine": "python",
      "rules": {
        "pre": [
          {
            "rule": "requestPayloadValid"
          }
        ],
        "post": []
      },
      "script": "if not isinstance(this.variables.pendingRequests, list):\n    this.variables.pendingRequests = []\nreq = {'requestId': args.requestId, 'taskId': args.get('taskId', f\"TASK-{args.requestId}\"), 'converterId': args.converterId, 'steelGrade': args.steelGrade, 'requiredByTime': args.requiredByTime, 'priority': args.get('priority', 50)}\nthis.variables.pendingRequests.append(req)\nthis.variables.processStatus = 'request_queued'\nreturn {'success': True, 'taskId': req['taskId']}",
      "parameters": {
        "requestId": {
          "type": "string"
        },
        "taskId": {
          "type": "string"
        },
        "converterId": {
          "type": "string"
        },
        "steelGrade": {
          "type": "string"
        },
        "requiredByTime": {
          "type": "string"
        },
        "priority": {
          "type": "number"
        }
      },
      "returns": {
        "success": {
          "type": "boolean"
        },
        "taskId": {
          "type": "string"
        }
      },
      "permissions": {
        "roles": [
          "dispatcher_operator",
          "mes_system",
          "system"
        ]
      }
    },
    "lockLadle": {
      "type": "script",
      "scriptEngine": "python",
      "rules": {
        "pre": [
          {
            "rule": "ladleNotLocked"
          }
        ],
        "post": []
      },
      "script": "if not isinstance(this.variables.resourceLocks, dict):\n    this.variables.resourceLocks = {}\nthis.variables.resourceLocks[args.ladleId] = {'taskId': args.taskId}\nreturn {'success': True}",
      "parameters": {
        "ladleId": {
          "type": "string"
        },
        "taskId": {
          "type": "string"
        },
        "isLocked": {
          "type": "boolean"
        }
      },
      "returns": {
        "success": {
          "type": "boolean"
        }
      },
      "permissions": {
        "roles": [
          "dispatcher_operator",
          "cortex",
          "system"
        ]
      }
    },
    "assignLadleToConverter": {
      "type": "script",
      "scriptEngine": "python",
      "rules": {
        "pre": [
          {
            "rule": "gradeCompatible"
          },
          {
            "rule": "temperatureSufficient"
          }
        ],
        "post": []
      },
      "script": "if not isinstance(this.variables.activeAssignments, dict):\n    this.variables.activeAssignments = {}\nthis.variables.activeAssignments[args.taskId] = {'taskId': args.taskId, 'ladleId': args.ladleId, 'converterId': args.converterId, 'steelGrade': args.steelGrade, 'totalScore': args.get('totalScore', 0), 'status': 'assigned'}\nthis.variables.processStatus = 'assignment_committed'\nreturn {'success': True}",
      "parameters": {
        "taskId": {
          "type": "string"
        },
        "ladleId": {
          "type": "string"
        },
        "converterId": {
          "type": "string"
        },
        "steelGrade": {
          "type": "string"
        },
        "gradeCompatible": {
          "type": "boolean"
        },
        "estimatedArrivalTemp": {
          "type": "number"
        },
        "minRequiredTemp": {
          "type": "number"
        },
        "totalScore": {
          "type": "number"
        }
      },
      "returns": {
        "success": {
          "type": "boolean"
        }
      },
      "permissions": {
        "roles": [
          "dispatcher_operator",
          "cortex",
          "system"
        ]
      }
    },
    "triggerReplan": {
      "type": "script",
      "scriptEngine": "python",
      "rules": {
        "pre": [
          {
            "rule": "replanWithinLimit"
          }
        ],
        "post": []
      },
      "script": "this.variables.replanCounter = this.variables.replanCounter + 1\nthis.variables.processStatus = 'replanning'\nthis.variables.lastError = args.get('reason', 'replan_triggered')\nreturn {'success': True, 'replanCounter': this.variables.replanCounter}",
      "parameters": {
        "taskId": {
          "type": "string"
        },
        "reason": {
          "type": "string"
        }
      },
      "returns": {
        "success": {
          "type": "boolean"
        },
        "replanCounter": {
          "type": "number"
        }
      },
      "permissions": {
        "roles": [
          "dispatcher_operator",
          "cortex",
          "system"
        ]
      }
    }
  },
  "states": {
    "idle": {
      "title": "空闲",
      "group": "dispatchState",
      "initialState": true
    },
    "evaluating": {
      "title": "评估中",
      "group": "dispatchState"
    },
    "assigning": {
      "title": "下发中",
      "group": "dispatchState"